### ISSUE TITLE
Problems with Websocket handshakes

### ISSUE THREAD

**Issue by MartinKunz** [boostorg/beast#561]
Hi, I'm having some problems getting the websocket connection working.

I am using more or less the websocket client code of your example here:

https://github.com/vinniefalco/Beast/blob/develop/example/websocket-client/websocket_client.cpp

As a server I am using this one (Example 2):

https://github.com/sta/websocket-sharp/tree/master/Example2

The server receives the handshake but always fails with:

                          HTTP/1.1 400 Bad Request
                          Server: websocket-sharp/1.0
                          Connection: close

The boost/beast error message is: "WebSocket Upgrade handshake failed"

Ip=XX.XXX.X.XX
Port=4649

Maybe I missed something obvious, but I expected the connection/handshake should be established between this client and server "out of the box"?

**Comment by vinniefalco** [comment]
>I expected the connection/handshake should be established between this client and server "out of the box"

Yes, it should. We're going to need more information in order to resolve this. Could you please capture a network trace of a client that successfully connects to that server? I'd like to see both the request and the response. You can use a browser as your client, for example you can point this app to your local server on port 4649:
https://www.websocket.org/echo.html

**Comment by vinniefalco** [comment]
Is this still an issue?

**Comment by MartinKunz** [comment]
Sorry, i couldn't test this at the weekend. Using the script from here:

https://www.websocket.org/echo.html

I also had no success connecting with the websocket-sharp server. So maybe the server implementation is broken. Here are the captured network pakets:

Frame 185: 557 bytes on wire (4456 bits), 557 bytes captured (4456 bits) on interface 0
Ethernet II, Src: IntelCor_08:79:5f (68:05:ca:08:79:5f), Dst: Fortinet_09:00:03 (00:09:0f:09:00:03)
Internet Protocol Version 4, Src: XX.XX.XX.XX, Dst: XX.XXX.X.XX
Transmission Control Protocol, Src Port: 49500, Dst Port: 4649, Seq: 1, Ack: 1, Len: 503
Hypertext Transfer Protocol
    GET / HTTP/1.1\r\n
    Host: XX.XXX.X.XX:4649\r\n
    User-Agent: Mozilla/5.0 (Windows NT 6.1; WOW64; rv:54.0) Gecko/20100101 Firefox/54.0\r\n
    Accept: text/html,application/xhtml+xml,application/xml;q=0.9,*/*;q=0.8\r\n
    Accept-Language: de,en-US;q=0.7,en;q=0.3\r\n
    Accept-Encoding: gzip, deflate\r\n
    Sec-WebSocket-Version: 13\r\n
    Origin: null\r\n
    Sec-WebSocket-Extensions: permessage-deflate\r\n
    Sec-WebSocket-Key: VgVzS1rryRTPVg5iIrKhGA==\r\n
    Connection: keep-alive, Upgrade\r\n
    Pragma: no-cache\r\n
    Cache-Control: no-cache\r\n
    Upgrade: websocket\r\n
    \r\n
    [Full request URI: http://XX.XXX.X.XX:4649/]
    [HTTP request 1/1]
    [Response in frame: 186]


Frame 186: 134 bytes on wire (1072 bits), 134 bytes captured (1072 bits) on interface 0
Ethernet II, Src: Fortinet_09:00:03 (00:09:0f:09:00:03), Dst: IntelCor_08:79:5f (68:05:ca:08:79:5f)
Internet Protocol Version 4, Src: XX.XXX.X.XX, Dst: XX.XX.XX.XX
Transmission Control Protocol, Src Port: 4649, Dst Port: 49500, Seq: 1, Ack: 504, Len: 80
Hypertext Transfer Protocol
    HTTP/1.1 501 Not Implemented\r\n
    Server: websocket-sharp/1.0\r\n
    Connection: close\r\n
    \r\n
    [HTTP response 1/1]
    [Time since request: 0.009202000 seconds]
    [Request in frame: 185]

**Comment by vinniefalco** [comment]
Try connecting to `ws://X.X.X.X/Echo`

replace `X.X.X.X` with the IP or domain name of the remote host running websocket-sharp

**Comment by MartinKunz** [comment]
Thats not working too. I opened an issue at the websocket-sharp project.

> https://github.com/sta/websocket-sharp/issues/379

For me it looks like it is a problem with their server. Sadly the hardware device i need to communicate with seems to use this server.

**Comment by MartinKunz** [comment]
One additional question. Do I need to call the

> io_service::run
> http://www.boost.org/doc/libs/1_56_0/doc/html/boost_asio/reference/io_service/run/overload1.html

function periodically using beast?
And could you please provide some async websocket examples too?

**Comment by vinniefalco** [comment]
You only need to call `run` if you use the asynchronous interfaces.

Yes, I will add more examples :)

**Comment by MartinKunz** [comment]
I got some feedback of the hardware manufacturer. And you were right. I had to use an uri like "/x/y" for the websocket upgrade request / handshake. The code looks like this:

> void SendUpgradeRequest()
> 	{
> 			boost::system::error_code errorCode;
> 			webSocket.handshake_ex(ip, uri,
> 				[](websocket::request_type& requestType)
> 				{
> 					requestType.set(http::field::user_agent, "My WebSocket");
> 				}, errorCode);
> 			if (errorCode)
> 			{
> 				LogError("Failed to send handshake: '%s'.", errorCode.message());
> 			}
> 		}

The server is responding then with a "Switching protocols" answer as expected:

> Hypertext Transfer Protocol
>     HTTP/1.1 101 Switching Protocols\r\n
>         [Expert Info (Chat/Sequence): HTTP/1.1 101 Switching Protocols\r\n]
>             [HTTP/1.1 101 Switching Protocols\r\n]
>             [Severity level: Chat]
>             [Group: Sequence]
>         Request Version: HTTP/1.1
>         Status Code: 101
>         Response Phrase: Switching Protocols
>     Server: websocket-sharp/1.0\r\n
>     Upgrade: websocket\r\n
>     Connection: Upgrade\r\n
>     Sec-WebSocket-Accept: EDqHu5tuHu00cmdsrKaOg4fk6is=\r\n
>     \r\n
>     [HTTP response 1/1]
>     [Time since request: 0.004452000 seconds]
>     [Request in frame: 51]

Now I need to request ("GET") some data from the server by a second uri "/x/z".
The following HTTP example worked for me:

> bool SendRequest(const string& sUri)
> 	{
> 		boost::system::error_code errorCode;
> 		http::request<http::string_body> req;
> 		req.method(http::verb::get);
> 		req.target(uri);
> 		req.version = 11;
> 		req.set(http::field::host, ip);
> 		req.set(http::field::user_agent, "My WebSocket");
> 		req.prepare_payload();
> 		http::write(m_Socket, req, errorCode);
> 		if (errorCode == 0)
> 		{
> 			return true;
> 		}
> 		else
> 		{
> 			LogError("Failed to send data: '%s'.", errorCode.message());
> 		}
> 		return false;
> 	}

But how would I do this with the beast websocket?

**Comment by MartinKunz** [comment]
And it seems that the websocket class does not handle ping/pongs on it's own? Do I need to handle them manually? I found no ping/pong example in the documentation and sadly all the links found via google or from older issues are broken.

When the server sends a ping to the beast websocket client there is no response, so that the server always closes the connection.

**Comment by vinniefalco** [comment]
_"During read operations, Beast automatically reads and processes control frames"_
http://vinniefalco.github.io/beast/beast/using_websocket/control_frames.html

You need to always have a read pending.

**Comment by vinniefalco** [comment]
>Now I need to request ("GET") some data from the server by a second uri "/x/z".

I don't understand what this means. GET is value found in HTTP requests. If you have to send an HTTP request then you need to use HTTP. WebSocket doesn't enter the picture. Just establish a second connection to your server and send the HTTP request as normal using Beast, then read the response.

**Comment by vinniefalco** [comment]
Is this still an issue?

**Comment by vinniefalco** [comment]
It looks like this issue has been resolved. If you are still have problems, please feel free to either re-open the issue or create a new one, thanks!

**Comment by Bardo91** [comment]
I am facing exactly the same issue. I have a server in C# and for the client, I am using Boost Beast. I am using intensively boost beast in another application for the server too, and the connections within C++ work properly. The problem appeared when I started using a WebSocket server from another language. Particularly, I am testing the WebsocketSharp library. A minimal example is:
- C#  https://gist.github.com/Bardo91/1fdbba1adb20a27976e72ee71794b6c3
- C++  https://gist.github.com/Bardo91/82664c317e4926492c77d43be9223dff

I have tried to connect to the C# server using python, and this webpage https://www.piesocket.com/websocket-tester and the connection works perfectly and I receive the messages.

But when I use the sample code above in C++ the connection consistently fails to do the handshake. The exception captured says `Error: The WebSocket handshake was declined by the remote peer [boost.beast.websocket:20]`
The deeper I can get is  in the "stream_iml.hpp" file, the response gives "Error 400"
![image](https://user-images.githubusercontent.com/3602335/153922140-8a2e1db4-c691-4b89-855f-6763e18d3150.png)

I tried comparing the HTTP requests (from python or the webpage, and the beast one and seems identical). 

Can someone give me any clue about the issue? It seems something very simple, and probably the problem is a lack of knowledge of the protocol. But I cannot find any answer that suits my situation. Actually this is the closest one as it was raised using the same library on the server's side. 

BTW: I identified the error in Ubuntu 20.04, using boost 1.70. But It happens too in WIndows 11, using Boost 1.77 (installed using VCPKG).

**Comment by madmongo1** [comment]
Would you be in a position to share the request and response headers?

**Comment by Bardo91** [comment]
For sure, this is the request I send using boost beast:
```
GET /test HTTP/1.1
Host: localhost
Upgrade: websocket
Connection: upgrade
Sec-WebSocket-Key: 3bvCeyC4WwSeBJ7TDYwgEQ==
Sec-WebSocket-Version: 13
User-Agent: Boost.Beast/322 websocket-client-coro
```

And the response is:
```
HTTP/1.1 400 Bad Request
Server: websocket-sharp/1.0
Connection: close
```

**Comment by madmongo1** [comment]
Hmm it looks fine. What would the equivalent header look like if you used wscat or python?

**Comment by Bardo91** [comment]
This is what I get using python websocket-client module (https://pypi.org/project/websocket-client/)

```
--- request header ---
GET /test HTTP/1.1
Upgrade: websocket
Host: 127.0.0.1:3000
Origin: http://127.0.0.1:3000
Sec-WebSocket-Key: C+/w6BD6XqbNxrJYbrB6+Q==
Sec-WebSocket-Version: 13
Connection: Upgrade


--- response header ---
HTTP/1.1 101 Switching Protocols
Server: websocket-sharp/1.0
Upgrade: websocket
Connection: Upgrade
Sec-WebSocket-Accept: gq+pGoN/PfY59rEoWvDNJYIRsUI=`
```

**Comment by madmongo1** [comment]
There are two differences: the Host header has the port number and there is an Origin header.

What’s happens if you set these fields prior to the async handshake?

**Comment by Bardo91** [comment]
That is true, actually, it is the first thing I tried to add yesterday unsuccessfully.

**However, I have just tried now and it works, so probably I messed up with something yesterday.**

As you have advised, I set these two fields and now the server is accepting the messages:
```
// Set a decorator to change the User-Agent of the handshake
ws.set_option(websocket::stream_base::decorator(
    [](websocket::request_type& req)
    {
        req.set(http::field::host, std::string("127.0.0.1:3000"));
        req.set(http::field::origin, std::string("http://127.0.0.1:3000"));
        std::cout << req << std::endl;
    }));
```

So we can mark this issue as solved. Thank you very much. I hope this thread helps more people in the future.

Just to conclude, is that a failure in the "basic" definition of an Upgrade request made with Beast, or is it an "extra requirement" that shouldn't be that strict by WebsocketSharp? From my perspective, it is a very simple example and both libraries should be compatible according to the standards. If the problem is in WebsocketSharp I might write to them so.  Thanks again.

**Comment by madmongo1** [comment]
I suspect it’s an in-necessary requirement of the c# library.
I’d be interested in their answer.

**Comment by Bardo91** [comment]
Great, I will come back to this issue with their Response.

**Comment by Bardo91** [comment]
After reading more in depth the RFC6455 protocol (https://datatracker.ietf.org/doc/html/rfc6455#section-1.3), it seems that at least the header field "host" is required.

```
The client includes the hostname in the |Host| header field of its
handshake as per [[RFC2616](https://datatracker.ietf.org/doc/html/rfc2616)], so that both the client and the server
can verify that they agree on which host is in use.
```

The standard also says
```
Additional header fields are used to select options in the WebSocket
Protocol.  Typical options available in this version are the
subprotocol selector (|Sec-WebSocket-Protocol|), list of extensions
support by the client (|Sec-WebSocket-Extensions|), **|Origin|** header
field, etc. 
```

So, shouldn't the implementation of Beast include at least the "host" by default?

**Comment by vinniefalco** [comment]
> shouldn't the implementation of Beast include at least the "host" by default?

Maybe. The examples all set it though.

**Comment by Bardo91** [comment]
Actually, I followed the examples when I tried it first, and I think it is not added. For example, for the sync client example (https://www.boost.org/doc/libs/develop/libs/beast/example/websocket/client/sync/websocket_client_sync.cpp)

The only header added in the `...set_option(decorator...)` is the "user-agent", but not the host field.

**Comment by madmongo1** [comment]
Hmm - I'll look into that - I wonder if we tested it against an undemanding host.

**Comment by kolomenkin** [comment]
> Actually, I followed the examples when I tried it first, and I think it is not added. For example, for the sync client example (https://www.boost.org/doc/libs/develop/libs/beast/example/websocket/client/sync/websocket_client_sync.cpp)
> 
> The only header added in the `...set_option(decorator...)` is the "user-agent", but not the host field.

Those example from Boost:Beast does not work. Alas!
The same problem as in the current topic (`[boost.beast.websocket:20]`)

**Comment by sehe** [comment]
@kolomenkin It is unclear what "the current topic (`[boost.beast.websocket:20]`)" refers to. Can you edit to clarify/include a link?

**Comment by kolomenkin** [comment]
> boost.beast.websocket:20]

I meant current issue (https://github.com/boostorg/beast/issues/561)

You were referring Boost.Beast sample as working example. But those example is broken. It does not work and it is producing the same failure during handshake with `echo.websocket.org:80`. It cannot upgrade protocol too:
`Error: The WebSocket handshake was declined by the remote peer [boost.beast.websocket:20]`

My idea was we should not argue like "additional header is not added in example, so we don't need it too". Example does not work too.

**Comment by kolomenkin** [comment]
Sorry, it seems `echo.websocket.org` service is no longer available. I'm not sure how to test those sample correctly other way.

**Comment by vinniefalco** [comment]
Try these: https://blog.postman.com/introducing-postman-websocket-echo-service/

**Comment by kolomenkin** [comment]
```bash
>Client.exe ws.postman-echo.com 443 Helloo

Error: The WebSocket handshake was declined by the remote peer [boost.beast.websocket:20]
```

Alas!

**Comment by kolomenkin** [comment]
They propose to use `wss://ws.postman-echo.com/raw`
I modified example to have `/raw` at the end:
`ws.handshake(host, "/raw");`

And here is a result:

```bash
Debug>Client.exe ws.postman-echo.com 443 Helloo
Error: The WebSocket handshake was declined by the remote peer [boost.beast.websocket:20]
```

Alas! :-(

**Comment by vinniefalco** [comment]
Maybe beast needs to add some more headers or something. Perhaps the Host field?

**Comment by kolomenkin** [comment]
Adding Host field does not help. I don't have any idea how to fix this.

**Comment by sehe** [comment]
Is SNI performed? What does the Host header require? Just `hostname.tld` or including port (like `hostname.tld:443`)?

**Comment by kolomenkin** [comment]
You were right about SNI & SSL.

I was using example `beast/example/websocket/client/sync/websocket_client_sync.cpp` which does not work with most of WebSocket services I could find.

And the following example works fine: `beast/example/websocket/client/sync-ssl/websocket_client_sync_ssl.cpp`
